"year","region","진료과","소속부서","보유장비","진료내용"
2021,"부산","마취통증의학과","수술실 및 회복실","관절경시스템","복부, 무릎이나 어깨관절, 방광및 요도, 이비인후등의 내시경수술시 절개하지 않고 특수 카메라가 부착된내시경과 비디오 모니터 등을 통해  특수기구를 이용하여 수술이 가능하게 하며 필요한 사진를 진료기록으로 전송및 저장함."
2021,"부산","마취통증의학과","수술실 및 회복실","방광요도경 시스템","복부, 무릎이나 어깨관절, 방광및 요도, 이비인후등의 내시경수술시 절개하지 않고 특수 카메라가 부착된내시경과 비디오 모니터 등을 통해  특수기구를 이용하여 수술이 가능하게 하며 필요한 사진를 진료기록으로 전송및 저장함."
2021,"부산","마취통증의학과","수술실 및 회복실","이비인후과내시경 시스템","복부, 무릎이나 어깨관절, 방광및 요도, 이비인후등의 내시경수술시 절개하지 않고 특수 카메라가 부착된내시경과 비디오 모니터 등을 통해  특수기구를 이용하여 수술이 가능하게 하며 필요한 사진를 진료기록으로 전송및 저장함."
2021,"부산","마취통증의학과","수술실 및 회복실","초음파 절제기(Harmonic scalpel)"," 초음파를 이용하여 수술시 조직을 자르고 지혈작용함."
2021,"부산","마취통증의학과","수술실 및 회복실","전파절삭기(Ligasure) ","수술부위 조직손상을 최소화하여수술후 통증을 줄이고 수술중 지혈작용함."
2021,"부산","마취통증의학과","수술실 및 회복실","전기소작기","전기를 이용하여 조직의 절개및 절제에 사용되며 수술중 지혈기능으로 사용함."
2021,"부산","마취통증의학과","수술실 및 회복실","무영등 및 수술대","광원을 집중시켜서 목적 부분에 그늘이 나타나지 않게 조명하는 전등장치,수술침대"
2021,"부산","마취통증의학과","수술실 및 회복실","마취기"," 마취 가스를 들이마시게 하여 마취하는 의료 기구. 마취 가스를 넣은 실린더, 압력계가 달린 감압 장치, 유량계, 판막 장치, 기화기, 이산화탄소 흡착기 따위로 이루어져 있다. "
2021,"부산","마취통증의학과","수술실 및 회복실","환자감시기","환자의 심박수, 심전도, 혈중산소포화도 등을 측정하여 모니터에 표시해줌"
2021,"부산","마취통증의학과","수술실 및 회복실","제세동기","심장마비 증상이 있을때 심장을 소생시킴"
2021,"부산","중환자실","중환자실","환자 감시 장치","심박동수, 혈중 산소 농도, 호흡수, 혈압 등 환자의 생체 정보를 감시하는 기구"
2021,"부산","중환자실","중환자실","인공호흡기","인공적으로 호흡을 조절하여 폐포에 산소를 불어넣는 장치"
2021,"부산","중환자실","중환자실","제세동기","부정맥이나 심정지시 심장에 고압전류를 극히 단시간 통하게 함으로써 정상적인 심박동으로 회복시키는 기기"
2021,"부산","중환자실","중환자실","고빈도 흉벽 진동기","규칙적인 흉벽 진동을 통해 기관지 벽에 있는 객담을 떨어트려 분비물 제거를 도와주는 기기"
2021,"부산","중환자실","중환자실","의약품 주입펌프","고농도, 고위험, 기타 정확한 용량의 주입이 필요한 정맥 주사용 약물을 정해진 속도, 시간에 따라 주입하는 기기"
2021,"부산","영상의학과","MRI실","자기공명영상장치","자기공명영상장치 및 컴퓨터전신단층촬영기는 두부, 복부, 골절, 수두종, 뇌출혈, 각종 뇌종양 및 기타 전신 어느 부위나 검사할 수 있으며 정확도가 높아 진료 각 과에서 광범위하게 이용"
2021,"부산","영상의학과","CT실","컴퓨터전신단층촬영기","자기공명영상장치 및 컴퓨터전신단층촬영기는 두부, 복부, 골절, 수두종, 뇌출혈, 각종 뇌종양 및 기타 전신 어느 부위나 검사할 수 있으며 정확도가 높아 진료 각 과에서 광범위하게 이용"
2021,"부산","영상의학과","초음파실","초음파진단기","초음파를 이용하여 주요장기(간, 신장, 췌장, 비장)의 크기, 모양, 질병유무 및 변이 등을 검사"
2021,"부산","영상의학과","특수촬영실","유방촬영기","각종 유방질환을 조기에 발견할 수 있으며 정기적 검진에 꼭 필요한 장비"
2021,"부산","영상의학과","특수촬영실","투시촬영기","식도,위, 대장등 소화기 질환의 질병유무등을 검사하며 정기적 검진에 꼭 필요함"
2021,"부산","영상의학과","골밀도검사실","골밀도검사기","골다공증 검사에 이용"
2021,"부산","영상의학과","일반촬영실","일반엑스선촬영기","디지털화된 최신 X-RAY 촬영기를 장치하여 각 진료과에서 이용할 수 있음"
2021,"부산","진단검사의학과","혈액검사실","혈액분석기","빈혈 등의 혈액질환, 혈액종양질환, 혈전질환 등의 진단을 위해 혈액, 체액, 골수 등을 분석하는 업무를 시행"
2021,"부산","진단검사의학과","혈액검사실","자동슬라이드염색기","빈혈 등의 혈액질환, 혈액종양질환, 혈전질환 등의 진단을 위해 혈액, 체액, 골수 등을 분석하는 업무를 시행"
2021,"부산","진단검사의학과","혈액검사실","혈액응고검사기","빈혈 등의 혈액질환, 혈액종양질환, 혈전질환 등의 진단을 위해 혈액, 체액, 골수 등을 분석하는 업무를 시행"
2021,"부산","진단검사의학과","임상화학검사실","생화학분석기","당뇨병이나 간질환, 신장질환의 진단에 필수적인 항목을 시행"
2021,"부산","진단검사의학과","임상화학검사실","응급면역화학분석기","당뇨병이나 간질환, 신장질환의 진단에 필수적인 항목을 시행"
2021,"부산","진단검사의학과","미생물검사실","혈액배양기","감염환자로부터 채취된 검체에서 원인균을 분리하여 균종을 밝혀내고, 효과적인 치료를 위하여 약제감수성검사 등을 시행. 세균검사, 진균(곰팡이)검사, 결핵균검사, 기생충검사 등을 시행"
2021,"부산","진단검사의학과","미생물검사실","미생물동정기","감염환자로부터 채취된 검체에서 원인균을 분리하여 균종을 밝혀내고, 효과적인 치료를 위하여 약제감수성검사 등을 시행. 세균검사, 진균(곰팡이)검사, 결핵균검사, 기생충검사 등을 시행"
2021,"부산","진단검사의학과","미생물검사실","형광현미경","감염환자로부터 채취된 검체에서 원인균을 분리하여 균종을 밝혀내고, 효과적인 치료를 위하여 약제감수성검사 등을 시행. 세균검사, 진균(곰팡이)검사, 결핵균검사, 기생충검사 등을 시행"
2021,"부산","진단검사의학과","미생물검사실","결핵액체배양기","감염환자로부터 채취된 검체에서 원인균을 분리하여 균종을 밝혀내고, 효과적인 치료를 위하여 약제감수성검사 등을 시행. 세균검사, 진균(곰팡이)검사, 결핵균검사, 기생충검사 등을 시행"
2021,"부산","진단검사의학과","혈청검사실","효소면역분석기","단백면역, 호르몬검사, 종양표지자검사, 바이러스, 항원 및 항체검사, 갑상선 기능검사 등을 시행"
2021,"부산","진단검사의학과","혈청검사실","면혁화학분석기","단백면역, 호르몬검사, 종양표지자검사, 바이러스, 항원 및 항체검사, 갑상선 기능검사 등을 시행"
2021,"부산","진단검사의학과","뇨화학검사실","뇨화학검사기","일반뇨를 이용하여 신장 및 비뇨생식기계, 간질환과 관련된 질병의 연관성을 알아보기위해 여러가지 물리 화학적인 검사 및 현미경을 통한 미세 요침사 판독 등을 수행"
2021,"부산","진단검사의학과","뇨화학검사실","뇨침사검사기","일반뇨를 이용하여 신장 및 비뇨생식기계, 간질환과 관련된 질병의 연관성을 알아보기위해 여러가지 물리 화학적인 검사 및 현미경을 통한 미세 요침사 판독 등을 수행"
2021,"부산","진단검사의학과","혈액은행","신선동결혈장해빙기","환자에게 안전하고 적합한 혈액을 공급하기 위한 여러가지 검사와 혈액의 관리, 보관, 공급에 관련된 업무를 수행"
2021,"부산","진단검사의학과","혈액은행","초저온냉동기","환자에게 안전하고 적합한 혈액을 공급하기 위한 여러가지 검사와 혈액의 관리, 보관, 공급에 관련된 업무를 수행"
2021,"부산","진단검사의학과","혈액은행","혈액냉장고","환자에게 안전하고 적합한 혈액을 공급하기 위한 여러가지 검사와 혈액의 관리, 보관, 공급에 관련된 업무를 수행"
2021,"부산","진단검사의학과","분자생물학검사실","자동중합효소연쇄반응장비","중합효소연쇄반응법을 이용하여 각종 감염질환을 조기에 발견하거나 이식검사를 위한 인체 조직적합성 항원 등의 검사를 실시"
2021,"부산","진단검사의학과","알레르기검사실","알러지분석기","알레르기의 원인을 분석하여 알러지 치료에 도움을 주는 역할을 담당"
2021,"부산","진단검사의학과","약물검사실","면역화학분석기","혈중 약물 농도를 측정하고 분석하여 적정한 약물이 체내에 투여되도록 도와주는 역할을 수행"
2021,"부산","진단검사의학과","응급검사실","응급검사시스템","응급환자들을 위해 반드시 필요한 검사에 한하여 신속한 검사결과를 보고하기 위한 시스템을 구축하여 수행"
2021,"부산","진단검사의학과","응급검사실","동맥혈가스분석기","응급환자들을 위해 반드시 필요한 검사에 한하여 신속한 검사결과를 보고하기 위한 시스템을 구축하여 수행"
2021,"부산","진단검사의학과","생리기능검사실","심전도검사실(심전도기)","심장의 전기생리학적 이해를 통하여 진단할 수 있는 심장의 부정맥(비정상적인 리듬)을 확인하며 심장질환을 검사하는데 있어 가장 기초가 되는 방법"
2021,"부산","진단검사의학과","생리기능검사실","근전도검사실(근전도검사기)","신경근계 질환을 진단하고 평가하는 검사로 신경이나 근육에서 가지고 있는 전기적 흥분성을 이용하여 말초신경계 병변과 근육계의 병변 이상여부를 관찰하는 검사를 수행"
2021,"부산","진단검사의학과","생리기능검사실","뇌혈류검사실(뇌혈류장비)","도플러효과를 이용해 뇌혈관 속에서 피가 흐르는 속도를 측정하는 검사법으로 초음파를 발사해 적혈구에서 반사되어 오는 파장으로 혈류속도 측정"
2021,"부산","진단검사의학과","생리기능검사실","폐기능검사실(폐기능검사장비)","호흡곤란의 원인규명, 폐기능 상태가 수술에 견딜 수 있는지의 판정을 위해 이루어지는 폐기능을 검사"
2021,"부산","진단검사의학과","생리기능검사실","적외선 전신 체열진단기","인체에서 자연적으로 방출되는 적외선을 감지하여 통증부위나 질병부위의 미세한 체온변화를 컴퓨터가 영상화하여 신체의 이상여부를 진단하는 최신검사기"
2021,"부산","진단검사의학과","생리기능검사실","뇌파검사실(뇌파검사기)","뇌파를 기록해서 여기서 얻어진 정보를 해독하여 질병에 대한 진단과 치료에 필요한 검사를 수행"
2021,"부산","병리과","병리과","자동염색기","조직 및 세포의 염색"
2021,"부산","병리과","병리과","마이크로톰","조직 절편 제작"
2021,"부산","병리과","병리과","자동침투기","조직 표본의 침투"
2021,"부산","병리과","병리과","현미경","조직을 확대하여 검사"
2021,"부산","병리과","병리과","조직포매기","조직의 포매, 파라핀 분주"
2021,"부산","병리과","병리과","자동봉입기","슬라이드 봉입"
2021,"부산","병리과","병리과","액상세포장비","세포검체 자동 도말"
2021,"부산","병리과","병리과","동결절편기","응급 검사시 조직을 동결하여 절편하는 장비"
2021,"부산","치  과","촬영실","파노라마전산화단층촬영기","치아의 파노라마 및 CT 영상 촬영용 엑스선장비"
2021,"부산","치  과","기공실","기공용엔진","치과 보철을을 다듬고 수리하는 기구"
2021,"부산","피부과","피부과","현미경","진균감염 및 피부기생충 질환의 진단 및 치료판정을 위해 도말 검사 실시"
2021,"부산","피부과","피부과","우드등","피부 병변의 색소성 변화를 관찰하여 정확한 진단 및 치료에 도움을 줌"
2021,"부산","피부과","피부과","색소 레이저","노인성 흑자, 주근깨, 지루각화증, 문신 등의 색소질환 치료 레이저"
2021,"부산","피부과","피부과","전기소작기이산화탄소레이저","점, 검버섯, 사마귀 및 양성 종양등의 제거 및 수술적 처치에 사용"
2021,"부산","피부과","피부과","자외선 치료기(전신용, 국소용)","건선, 백반증, 소양증 등의 질환 치료에 사용"
2021,"부산","한방과","한방침구과","전침","침에 지속적인 전기 자극을 주어 각 파형에 따라 통증 및 근무력 치료 등에 사용"
2021,"부산","한방과","한방침구과","이측탐지기","귀의 혈자리 파악에 사용"
2021,"부산","한방과","한방침구과","맥진기","맥을 파형으로 분석하는 장비"
2021,"대전","내과","심혈관센터","혈관조영장치심장초음파진단기심전도검사기24시간심전도-혈압검사기폐기능검사기동맥경화진단기운동부하검사기","심장질환의 환자의 검사, 진단, 치료를시행"
2021,"대전","내과","내시경실","내시경시스템위내시경기관지 내시경대장 내시경","식도의 병변,위궤양,위암,소장 및 대장암,담낭 및 췌장질환,기타 질병을 진단"
2021,"대전","내과","인공신장실","혈액투석기혈류측정기체수분검사기","혈액 투석 시 투석 환자의 편의제공"
2021,"대전","소아청소년과","","","영·유아 환자의 외과적 질환,즉 선천성 기형,탈장,거대결장 등 소아질환의 전문상담 및 치료"
2021,"대전","정신건강의학과","뇌파 검사실","뇌파 검사기","정신과,내과,신경외과 등에서 주로 이용하며 뇌기능 장애에 의한 정신병,간질,뇌종양,뇌혈관 질환 등을 정확히 진단"
2021,"대전","정신건강의학과","임상심리실","","인간의 심리적 문제를 이해하고 심리적 건강과 적응 향상을 위해 개입, 연구를 시행하며 발견된 다양한 정신 장애 및 심한 수준의 적응 문제를 확인"
2021,"대전","정신건강의학과","스트레스클리닉","","뇌가 심각한 스트레스를 받으면 아드레날린과 코티졸이라는 호르몬의 분비로 인해 불안,우울,두통,치매 등 질병을 유발하므로 이러한 증상을 사전예방하기 위한 치료를 시행"
2021,"대전","정신건강의학과","PTSD 클리닉","EMDR","Eye scan 및 컴퓨터 프로그램을 활용, 안구운동 유발로 기억감정들을 재처리함으로써 정신을 치료"
2021,"대전","일반외과","다한증 클리닉복강경 클리닉","복강경 수술기초음파진단기항문경하지정맥레이저치료기","일반외과 전문의로 하여금 소장 및 대장암,하지정맥,기타 질병을 정확히 진단하여 복강경내의 각종 질환 수술 및 상담과 항문재건술을 시행"
2021,"대전","신경외과","","뇌혈류 초음파","뇌혈관 질환,각종 척추질환 및 기타 신경질환의 상담과 수술을 시행 함으로써 기능개선 및 회복을 도모"
2021,"대전","신경과","유발전위검사실","유발전위검사기","중추신경장애 환자 및 말초신경장애,즉 신경근경,말초신경병증,신경근접합부 근육질환의 원인과 그 경과 예후 판정 치료"
2021,"대전","정형외과","인공관절클리닉","","각종 질환에 의하여 파괴된 관절을 인공관절을 사용하여 복원함"
2021,"대전","정형외과","관절경 클리닉","관절경","관절경을 이용하여 관절의 피부절개 없이 진단 및 수술·치료를 시행"
2021,"대전","산부인과","초음파실","초음파 진단기","임신 초기의 이상유무,태아성숙도,태반 위치 판정 등에 사용하며 자궁암의 조기진단 및 치료 상담"
2021,"대전","비뇨의학과","전립선 클리닉","방광경초음파진단기,경요도적 수술과 방광 및 요도의 이상을 진단하고 치료",""
2021,"대전","피부과","","CO2 레이저냉동치료기광선치료기","탄산가스 레이저를 이용하여 시술 및 치료 할 수 있으며 색소성모반(점)등 피부과의 각종 치료 환자에게 유용하게 사용"
2021,"대전","안과","시야 검사실","알곤레이저주변시야계야그레이저세극등현미경각막곡률측정기안압기백내장 수술기","각종 각막의 질환 및 굴절 장애 검사 그리고 환자의 시력을 자동으로 측정하여 근시,원시 등의 굴절장애 환자들에게 신속 정확한 교정에 도움"
2021,"대전","이비인후과","","후두내시경,후두암 등의 검사 및 후두의 이물질 제거 등을 시행",""
2021,"대전","이비인후과","청력 검사실","뇌간유발검사기표준 순음 청력 검사기임피던스 청력 검사기","뇌간유발검사,순음 청력 검사,임피던스 청력검사 등을 이용한 청각 장애자의 진단과 보청기 선택 및 청력 훈련 지도"
2021,"대전","재활의학과","근전도실수치료실물리치료실","근전도 검사기전신욕조레이져 치료기초음파 치료기저주파치료기","근전도 검사를 시행하여 신경 근육의 각종 질환의 진단을 비롯하여 말초 신경의 손상 부위 정도 예후를 판정하고 온열치료 및전기치료,수치료 등을 시행하고 통증 환자의 통증을 제거함"
2021,"대전","재활의학과","작업치료실,종합작업치료기구지각운동기구수지훈련기인지재활기기일상생활기기연하장애치료기","일상생활치료,연하지료,인지치료를 각종 장비 및 도구를 사용하여 치료",""
2021,"대전","재활의학과","언어치료실","언어치료기""","언어능력 및 기술을 향상시켜 환자의 생각과 감정을 효율적으로 전달하기 위해 정확한 진단과 평가를 통한 치료"
2021,"대전","재활의학과","체외충격파치료실","체외충격파치료기","퇴행성 및 근골격계(석회성건염,족저근막염등) 질환을 치료"
2021,"대전","마취통증의학과","수술실","수술 현미경수술용씨암마취기무영등 수술대환자감시장치환자고정대","수술 시 환자의 체위고정 및 수술부위에 그림자가 없이 수술을 시행"
2021,"대전","마취통증의학과","통증클리닉","고주파 열응고기","척추수술 및 동통치료 시 병의 근원이 되는 신경부위를 고주파의 원리를 이용 통증 및 병변 부위를 치료"
2021,"대전","중환자실","중환자실","환자감시장치인공호흡기","전 진료과에서 집중진료를 요하는 중환자를 최신 의료장비로 집중적으로 치료"
2021,"대전","영상의학과","X-선 촬영실","투시전용 X-ray디지털 X-ray디지털 흉부 X-ray","최신 X-ray 촬영기를 장치하여 각 진료과에서 이용할 수 있으며, 특수촬영으로 식도,위장,소장,대장,담낭,신장,혈관조영술,자궁난관 조영술을 시행"
2021,"대전","영상의학과","MRI 촬영실","MRI 촬영기","방사선 검사와 달리 방사선 피폭 등의 불안요소 없이 수술을 하지 않고 인체내부를 관찰할수 있는 첨단 영상기법으로 암, 관절, 연부조직 등의 진단을 정확히 내릴수 있는 영상진단 장비"
2021,"대전","영상의학과","CT 촬영실","CT 촬영기","두부,복부,골절,수두종,뇌출혈,각종 뇌종양 및 기타 전신 어느 부위나 단층 촬영에 의해 검사할 수 있으며 정확도가 높아 진료 각 과에서 광범위하게 이용"
2021,"대전","영상의학과","초음파 진단실","초음파 진단기","내과에서 담낭,간,췌장,비장의 진단에 이용되고 비뇨기과에서 신장질환 진단에 이용"
2021,"대전","영상의학과","골밀도 촬영실","골밀도 촬영기","고령 및 폐경기 여성의 대사성 질환으로 야기되는 골다공증에 대한 정밀 진단에 이용"
2021,"대전","진단검사의학과","혈액실","","항상 신선한 혈액을 준비하여 응급수혈을 요하는 환자가 기타 수혈을 요하는 환자에게 신선한 혈액을 공급할 수 있도록 관리 운영"
2021,"대전","진단검사의학과","미생물실","미생물동정기항생물징검사기염색기미생물안전캐비넷","'각 종 미생물 배양검사를 시행"""
2021,"대전","진단검사의학과","임상검사실","생화학 검사기혈구계산기세균검사원심분리기현미경","독물화학검사,혈액가스검사를 시행하고 세균검사로 세균동정 혈액균,결핵균 진료 배양검사 시행 자동혈액분석기를 이용하여 간장기능을 검사하고 간장 질환 진단"
2021,"대전","건강검진과","종합검진실","체성분 분석기청력검사기영상시력측정기자동혈압계","신체의 체성분인 수분,근육,지방,단백질을 분석하여 몸의 균형관리,비만관리,운동처방등 건강증진에 이용"
2021,"대전","가정의학과","","","일상 생활에서 발생하는 질병의 진단과 치료,예방과 재활·건강상담에 이르기까지 평생 관리를 받을 수 있도록 함"
2021,"대전","한방진료과","","전자침적외선조사기","한의학의 이론에 의거한 침,뜸,부항과 같은 전통적인 방법을 사용하여 질병으로 치료"
2021,"대전","치과","진료실","진료용유니트무영등세척기","치과 진료 및 임플란트 전용 수술실에서 수술, 치료를 하고 각 종기구 또한 세척이 가능하여 치과환자 처치를 원활히 할 수 있도록 운영"
2021,"대전","치과","기공실","기공용 엔진보철수술기구","치아 손상 및 치아 기능장애 환자치료"
2021,"대구","내과","내시경실","위내시경,대장내시경,환자감시장치","내과, 일반외과 전문의로 하여금 식도의 병변, 위궤양, 위암, 소장 및 대장암, 직장암, 담낭 및 췌장 질환, 기타 질병을 진단하여 외과, 비뇨기과 전문의와 협조하여 수술요법을 시행"
2021,"대구","내과","동맥경화도검사실","동맥경화도검사,중심대동맥압측정기","혈관의 탄력성과 혈관 내막의 침전 정도을 정량적으로 측정 및 중심 대동맥 혈압을 측청하여 고혈압 예측과 동맥 관련 질환을 진단"
2021,"대구","내과","심장박동기검사실","심장박동기 검사","심장박동기의 기기상태 및 심장의 상태(부정맥)을 검사"
2021,"대구","내과","운동부하검사실","24시간 심전도기,24시간 혈압측정기,운동부하 심전도기,경사기립도검사기","혈압의 변동을 파악하고 심장의 부정맥, 협심증 등 심장질환의 진단 및 치료"
2021,"대구","내과","ANGIO실","혈관조영촬영기,의료용 3D 입체정위기","인공심박동기, 스텐트삽입술, 풍선확장술, 정맥 내 카테터유치술 등 심혈관 및 부정맥 분야 중재적 시술 시행"
2021,"대구","내과","심장초음파실","초음파심장조영장치","심혈관계의 이상유무 검사를 통한 심장질환진단"
2021,"대구","소아청소년과","","","소아과 환자의 알레르기 검사 및 성장 검사 등 소아질환 관련 전문적인 상담과 치료"
2021,"대구","신경과","임상심리실","근전도 검사기,뇌파(EEG) 검사기","중증신경장애 환자, 신경병증 뇌경색 등 뇌혈관질환, 파킨슨병 등 운동장애 질환, 말초신경질환 및 근육질환, 뇌전증, 두통 및 현훈, 치매 등 치료"
2021,"대구","정신건강의학과","임상심리실","뇌파검사기","뇌기능 장애에 의한 정신병, 간질, 뇌종양, 뇌혈관 질환 등을 정확히 진단하고 치매, 인지기능 등과 관련한 정신관련 심리검사진행을 통해 평가 및 치료"
2021,"대구","피부과","","CO2 laser","일반 피부질환, 진균증(무좀)치료, 건선, 알레르기 검사, 피부종양클리닉 등 피부질환 관련 검사 및 치료"
2021,"대구","재활의학과","물리치료실","근전도검사,수치료기,초단파치료기,적외선치료기,전기자극치료기,레이져치료,체외충격파치료기,연하장애치료기","근전도검사를 시행하여 신경근육의 각종질환의 진단을 비롯하여 말초신경의 손상정도 예후를 판정하고 온열치료 및 전기치료, 운동치료, 수치료, 체외충격파치료 등을 시행하여 통증환자의 통증을 제거하고 재활 치료 및 훈련을 통하여 환자의 손상된 기능 회복"
