"year","region","진료과","소속부서","보유장비","진료내용"
2019,"광주","내과","소화기","위내시경","상하부 위장 질환, 간질환 위암, 간암진단 및 치료, 내시경"
2019,"광주","내과","(내시경실)","S상 결장경","역행성 담췌관조영술(ERCP)"
2019,"광주","내과","(내시경실)","초음파 내시경","치료내시경(용종절제술/EVL/헤모클립 지혈술/내시경적 점막절제술)"
2019,"광주","내과","순환기","심혈관조영기","심장질환과 혈관질환에 대해 전박적인 검사 및 치료 시행"
2019,"광주","내과","(심혈관조영실)","(Angio)","고혈압, 심부전증, 심장판막질환, 동맥경화증, 고지혈증, 부정맥, 협심증"
2019,"광주","내과","(심혈관조영실)","심장초음파","심방세동, 허혈성 심질환 진단 및 치료"
2019,"광주","내과","(심혈관조영실)","심운동부하검사","관상동맥 조영술, 경피적 혈관내 금속스텐트 삽입술, 풍선혈관성형술"
2019,"광주","내과","(심혈관조영실)","동맥경화검사","말초혈관성형술(상, 하지), 경동맥혈관 성형술"
2019,"광주","내과","(심혈관조영실)","","영구적 심장박동기 삽입술"
2019,"광주","내과","호흡기","흉부 CT","호흡기질환(만성 폐쇄성 폐질환, 폐렴 , 호흡부전, 폐암, 결액) 간질성 폐질환"
2019,"광주","내과","호흡기","폐용량 및 폐기능검사기","(폐섬유화증 포함), 만성기침, 천식, 기관지 확장증, 흉막염, 급성 성인형"
2019,"광주","내과","호흡기","기관지내시경검사","호흡 곤란 증후군등 인공호흡기가 필요한 중증 호흡기 질환 등을 진료"
2019,"광주","내과","내분비","골밀도검사","당뇨병, 갑상선질환, 뇌하수체질환, 골다공증 및 갱년기증후군, 비만 및"
2019,"광주","내과","내분비","체성분검사","기타 내분비 질횐 진단 및 치료"
2019,"광주","내과","내분비","자율신경기능검사",""
2019,"광주","내과","신장(인공신장실)","혈액투석기(31대)","급 만성 신부전증, 당뇨병, 고협압, 전해질장애 진단 및 치료"
2019,"광주","내과","신장(인공신장실)","","인공신장실(혈액투석, 복만투석환자 치료 )"
2019,"광주","내과","혈액종양내과","","각종 혈액 질환과 종양의 진단과 치료"
2019,"광주","내과","감염내과","","세균, 바이러스, 기생충 등 미생물의 인체 감염에 의한 질환 진료감기, 인플루엔자, 폐렴, 폐외 결핵, 패혈증, 신우신염, 매독, 에이즈, 말라리아, 쯔쯔가무시, 감염성 설사, 피부 감염 등의 감염질환증상으로는 발열, 오한, 전신통, 인후통, 기침, 배뇨통, 설사, 피부 발진, 피부 농양, 임파선 종대 등의 증상을 진료"
2019,"광주","소아청소년과","클리닉","","급성 호흡기 질환 및 소화기질환 치료"
2019,"광주","소아청소년과","(성 조숙증, 소아알레르기","","환경오염으로 점점 증가하는 알레르기 환자와 기후의 변화 , 환경호르몬 영향"
2019,"광주","소아청소년과","신생아 및 미숙아","","으로 급속도로 증가 중인 성조숙증 환자 진료"
2019,"광주","소아청소년과","영유아, 소아발달장애","","비염, 천식, 중증 아토피 환자를 대상으로 알레르기 면역치료 시행"
2019,"광주","소아청소년과","비만 치 저신장, 소아당뇨)","","모세기관지염, 페렴, 장염 등의 급성질환 체계적 치료"
2019,"광주","소아청소년과","소아 심장학","심장초음파","소아심장질환 (심전도 및 심초음파실) 전문적 치료"
2019,"광주","소아청소년과","소아 신경학","뇌파검사","소아신경학 치료"
2019,"광주","소아청소년과","신생아실","인큐베이터실","신생아실은 미숙아를 집중 치료"
2019,"광주","신경과","뇌신경센터","뇌 자기공명영상진단기(MRI)","인체의 신경계(중추 신경계, 말초신경계)와 관련된 질병 치료"
2019,"광주","신경과","뇌신경센터","뇌 단층촬영기","뇌혈관 의 이상에 의해 발샹하는 반산마비, 구언장애, 의식장애 등을 다루는"
2019,"광주","신경과","뇌신경센터","뇌 양전자단층촬영(Pet-ct)","뇌졸증 분야,  뇌허혈에 의한 경색, 뇌출혈, 뇌혈관 기형 등 뇌에서 일어나는"
2019,"광주","신경과","뇌신경센터","비디오 안진검사","혈관과 관련된 질환 치료"
2019,"광주","신경과","뇌신경센터","뇌파검사","손발저림, 근육위약과 위축 등 말초신경계를 다루는 말초신경 및 근육질환 분야"
2019,"광주","신경과","뇌신경센터","자율신경검사기","파킨슨 병과 간은 운동장애를 다루는 운동질환 분야, 간질,  알츠하이머병,"
2019,"광주","신경과","뇌신경센터","근전도 검사","인지 기능 저하와 관련된 치매, 신경계 감염 분야와 어지러움증, 안과 이상 을"
2019,"광주","신경과","뇌신경센터","경동맥초음파","다루는 신경이안과, 두통 등 신경계 종양 분야 치료"
2019,"광주","신경과","신경심리실","","임상심리사가 신경심리검사를 통해 신경계와 관련된 전문진단 검사 시행"
2019,"광주","정신건강의학과","","뇌파검사기","기분장애, 불안장애, 알코올 등 중독장애, 수면장애, 신경인지 장애 등의 정신"
2019,"광주","정신건강의학과","","","의학적 질환 치료"
2019,"광주","정신건강의학과","","","불면증(수면장애), 치매를 비롯한 신경인지장애에 대한 치료"
2019,"광주","정신건강의학과","","","공황장애, 불안장애, 우울증 등의 기분장애에 대한 진료"
2019,"광주","정신건강의학과","임상심리실","","신경인지장애 환자 및 정신의학적 질환에 대해 전문검사 시행"
2019,"광주","피부과","","","피부질환, 색소성 피부질환, 레이져치료, 알레르기 질환"
2019,"광주","피부과","","냉동치료기","광선각화증, 사마귀 등 치료"
2019,"광주","피부과","","Co2  laser","지루각화증, 모반, 피지샘 증식증 등을 치료"
2019,"광주","피부과","","","편평세포암, 기저세포암 등을 치료을 피부조직검사 및 양성종양 절제술 시행"
2019,"광주","가정의학과","","","가정의학과 질병의 예방적인 진료와 상담, 내,외과계를 포함한 전진료과에"
2019,"광주","가정의학과","","","대하여 폭넓은 진료 실시"
2019,"광주","가정의학과","노인의학 클리닉","","노화에 따른 신체적 및 정신적 기능의 변화, 노인성질환의 진단과 치료"
2019,"광주","가정의학과","노인의학 클리닉","","노인성 증후군의 예방과 관리"
2019,"광주","가정의학과","완화의료병동","29병상","말기암 환자의 마지막 순간을 편안하고 의미 있게 맞이 할 수 있도럭 완화의료"
2019,"광주","가정의학과","완화의료병동","","전담팀을 구성, 의학적 도움  및 남은 삶을 평화로운 가운데 의미 있게 보낼 수"
2019,"광주","가정의학과","완화의료병동","","있도록 총체적인 의료서비스 제공"
2019,"광주","한의과","치료실","","인체에 나타나는 여러증상에 대해 한의학적 관점을 기초로 침구 및 부황치료 시행"
2019,"광주","한의과","치료실","","근골격계질환 통증제어 침구치교, 뭉친근육을 풀어주는 부황치료"
2019,"광주","한의과","치료실","","뼈와 근육을 강화시켜주는 약물 치료"
2019,"광주","한의과","치료실","적외선 체열진단기","인체에서 자연적으로 방출되는 적외선을 감지하여 인체의 통증부위와 질병부위의"
2019,"광주","한의과","치료실","","미세한 체열변화를 컬러 영상으로 나타내주어, 신경병증, 근육통증, 순환장애"
2019,"광주","한의과","치료실","","염증성 질환을 진단"
2019,"광주","재활의학과","재활센터","초단파 치료기","뇌졸증재활, 근골격계통증재활, 척추손상재활, 노인재활 등 진단및 치료"
2019,"광주","재활의학과","재활센터","초음파치료기","일반적으로 어떠한 질환의 합병증을 초기에 예방하고, 질병이나 부상으로 생긴 장애"
2019,"광주","재활의학과","재활센터","적외선치료기","를 가진 환자의 기능적인 회복을 위해 재활치료 실시"
2019,"광주","재활의학과","재활센터","전기자극치료기","물리치료, 작업치료, 언어치료 실시"
2019,"광주","재활의학과","재활센터","근전도기","중추신경 및 말초신경 등 근육 질환 진단하고 예후 판정"
2019,"광주","재활의학과","재활센터","체외충격파 치료기","고에너지를 충격파를 이용하여 최소침습, 비수술요법으로 근골격계 통증치료"
2019,"광주","진단검사의학과","임상검사실","화학검사기","환자로 부터 채취된 혈액, 골수, 혈장, 혈청, 소변, 대변, 흉수 등 각종검체에 대하여"
2019,"광주","진단검사의학과","임상검사실","혈액검사기","임상병리사가 진단혈액, 임상미생물, 수혈의학, 진단면역, 분자진단 및 생리기능검사"
2019,"광주","진단검사의학과","임상검사실","세균검사기","를 실사하며, 24시간 응급검사 및 혈액은행 검사 업무 시행"
2019,"광주","진단검사의학과","임상검사실","전해질분석기",""
2019,"광주","진단검사의학과","임상검사실","심전도검사기",""
2019,"광주","병리과","조직검사실","자동조직표본제작기","해부병리과 전문의가 조직검사 또는 세포검사를 통하여, 질병의 원인, 장기나 조직"
2019,"광주","병리과","조직검사실","조직절편기","변화 등을 판독 진단"
2019,"광주","병리과","조직검사실","동결조직절편기",""
2019,"광주","병리과","조직검사실","조직포매기",""
2019,"광주","병리과","조직검사실","자동염색기",""
2019,"광주","영상의학과","자기공명영상장치실(MRI)","자기공명영상장치","뇌충추신경계 및 척추신경 심맥관계 및 흉 복부 골반근골격계 및 사지 등의 진단장비"
2019,"광주","영상의학과","자기공명영상장치실(MRI)","(최신형 초전도 MRI 3.0 T)",""
2019,"광주","영상의학과","컴퓨터당층촬영기실(CT)","컴퓨터당층촬영기(CT)","두부외상 및 골절, 수두종, 뇌출혈 각종종양 등 질환 및 훙부, 복부, 근골계 등"
2019,"광주","영상의학과","컴퓨터당층촬영기실(CT)","","뇌의 전신의 질환을 진단"
2019,"광주","영상의학과","초음파","초음파","복부, 간, 갑상선, 유방, 근골격계 등  부위 검사 시행"
2019,"광주","영상의학과","일반촬영","일반촬영","단순 흉부, 복부, 단순 골격, 단순 부비동, 단순경부 연조직, 유방 촬영 등 실시"
2019,"광주","영상의학과","특수촬영","","요로조영검사, 내시경적 역행성 담도췌관조영술 (ERCP) 시행"
2019,"광주","영상의학과","중재적시술","투시 및 혈관조영 엑스선기","TACE(간동맥화학색전술), RFA(고주파열치료), PICC(말초혈관둥심정맥유치술)"
2019,"광주","영상의학과","중재적시술","","PCD(경피적카테터배액술) 등 시행"
2019,"광주","핵의학과","PET-CT 실","양전자단층촬영(PET-CT)","양전자방출 단층 촬영장치 는 암(종양) 진단, 전이 암이 발결된 환자에서 원발"
2019,"광주","핵의학과","PET-CT 실","","병소 발견, 암의 범위 평가, 뇌질환 진단 및 심장 질환 진단"
2019,"광주","핵의학과","PET-CT 실","","파킨슨병의 진단에 사용되는 F-18 FP-CIT PET-CT 실시"
2019,"광주","핵의학과","체내검사실","감마카메라","심근혈류, 뇌혈류, 전신 뼈, 신장기능, 갑상선, 소화기계 검사 등 검사 시행"
2019,"광주","외과","대장, 항문 클리닉","S상 결장경","소화기암(위암,대장암), 내분비계질환(갑상선암, 두경부 질환 및 종양)"
2019,"광주","외과","유방암 클리닉","초음파","간,담도, 취장질환, 복강경 수술,대장 항문질환,  혈관질환, 소아외과"
2019,"광주","외과","복강경 클리릭","유방촬영기","위장관 질환, 유방 질환 정맥질환  등을  수술 및 진단 치료"
2019,"광주","정형외과","관절센터","자기공명영상장치(MRI)","슬관절, 인공치환수술, 근골계질환, 스포츠손상, 사지마비 및 기형 교정"
2019,"광주","정형외과","관절센터","컴퓨터당층촬영기(CT)","고관절, 관절염치료 및 관절경 수술, 각종 골절 및 탈구 외상치료"
2019,"광주","정형외과","관절센터","초음파","각종 요통 및 척추질환의 진단과 치료"
2019,"광주","정형외과","관절센터","관절경","관절경을 이용하여 관절의 피부절개 없이 진단 및 치료(수술)가 가능"
2019,"광주","정형외과","관절센터","골밀도 측정기","골다골증애 대한 정말 진단 및 치료"
2019,"광주","정형외과","석고실","","석고를 이용한 고정치료"
2019,"광주","신경외과","척추센터","자기공명영상장치(MRI)","뇌하수체 종양, 뇌기저부 질환, 뇌혈관질환, 뇌출혈, 뇌경색, 척추신경질환"
2019,"광주","신경외과","척추센터","컴퓨터당층촬영기(CT)","(허리, 목 디스크), 두부외상, 혈과내 수술"
2019,"광주","신경외과","척추센터","적외선 체열진단기","인체에서 자연적으로 방출되는 적외선을 감지하여 인체의 통증부위와 질병부위의"
2019,"광주","신경외과","척추센터","","미세한 체열변화를 컬러 영상으로 나타내주어, 신경병증, 근육통증, 순환장애"
2019,"광주","신경외과","척추센터","","염증성 질환을 진단"
2019,"광주","산부인과","","초음파 검사","여성의 생식 기능과 연관된 정상 생리 및 질병 진료"
2019,"광주","산부인과","","","골반염, 자궁내막증, 자궁근종, 자궁선근증, 난소낭종등 을 진료"
2019,"광주","산부인과","","","자궁 경부암(자궁확대경검사) 진단 및 치료"
2019,"광주","산부인과","","복강경","여성 불임환자와 남성 불임환자를 각종 특수검사 시행하여 불임 진단 및 치료"
2019,"광주","산부인과","","","복강경을 이용한 영구 피임시술 시행"
2019,"광주","산부인과","","","요실금(약물치료, TOT  수술) 부인과 성형수술 골다공증 폐경기클리닉"
2019,"광주","산부인과","","","상담 후 수술 및 진단과 치료"
2019,"광주","산부인과","","골밀도 검사","폐경을 전후한 여성은 여성호르몬의 감소 (골다공증, 심장질환, 우울증, 불면증"
2019,"광주","산부인과","","","불안증, 안면홍조, 기억력 및 집중력 감퇴) 로 인한 질병 관리"
2019,"광주","이비인후과","","","귀, 코, 목으로 불리는 5개의 구멍과 구멍들이 위치한 안면부와 목을 진료"
2019,"광주","이비인후과","난청클리닉","","귀, 코 목의 감각기관들의 청각검사, 전정기능검사, 후각검사, 수면간이 검사를 통해"
2019,"광주","이비인후과","어지러움 클리닉","안진검사기","질환들을 진단"
2019,"광주","이비인후과","청력검사실","청력검사기","이명, 노인성 난청, 어지러움증, 중이염, 안면신경마비, 만성부비동염, 비염"
2019,"광주","이비인후과","전정기능 검사실","","인후두 역류 질환 등 진료"
2019,"광주","안과","","IOL master","눈꺼풀과 눈물기관, 안와, 결막, 각막, 공막, 수정체, 포도막, 유리체, 망막의 질병들과"
2019,"광주","안과","","자동시야검사계","녹내장, 사시, 굴절이상, 시신겨으및 시각 경로의 질병 들, 전신질환과 관련하여"
2019,"광주","안과","","자동굴절검사계","눈에 생길수 있는 광범위한 질환들을 치료"
2019,"광주","안과","","각막두께측정기","백내장 수술시 최적의 인공수정체 도수결정을 위한 최첨담 장비 및 녹내장 등의"
2019,"광주","안과","","초음파 Ascan","심각한 안과 질환등을 진단하는 장비로 진단 및 치료 시행"
2019,"광주","안과","","자동안압계",""
2019,"광주","안과","","안구광학단층촬영기",""
2019,"광주","비뇨의학과","종양클리닉","내시경 수술기","소변을 만들고 운반하고 배설하는 기능을 담당하는 요로계( 신장, 요관, 방광, 요도),"
2019,"광주","비뇨의학과","전립선클리닉","고주파 수술기","남성 생식기관(고환, 부고환, 음낭, 음경) 및 부속성선(전립선, 정낭)과 부신에 생기는"
2019,"광주","비뇨의학과","방광경검사실","방광경","질환을 진단하고 진료"
2019,"광주","비뇨의학과","배뇨기능검사실","가스방광내압측정기","종양클리닉(방광암, 전립선임, 신장암 등) 운영"
2019,"광주","비뇨의학과","체외충격파 쇄석실","체외충격파쇄석기","전립선 클리닉( 전립선 초음파 및 조직검사, 전립선 수술 등) 운영"
2019,"광주","비뇨의학과","체외충격파 쇄석실","","여성 요실금 치 배뇨장애 클리닉(체외 자기장 치료기, 요실금 수술 등) 운영"
2019,"광주","비뇨의학과","체외충격파 쇄석실","","요로결석 클리닉(체외 충격파 쇄석기, 요관경하 배석술 등) 운영"
2019,"광주","비뇨의학과","체외충격파 쇄석실","","성기능 장애 클리닉 운영"
2019,"광주","치과","소수술실","Dental CT","치아와 그 주위 조직 및 구강을 포함한 악안면 영역의 질병이나 비정상적 상태 등을"
2019,"광주","치과","소수술실","Panoramic","예방하고 진단하며 치료"
2019,"광주","치과","소수술실","","외과적 처치(발치, 치주수술, 임플란트 시술 등)와 비외과적 처치(우식 와동 충전 처치,"
2019,"광주","치과","소수술실","","신경치료 , 보철수복 처치 등)  예방치료( 치석제거 등)"
2019,"광주","마취통증의학과","수술실","","수술에 대한 전신마취, 부위마취, 진정 시행, 수술 외 처치에 필요한 진정이나 마취"
2019,"광주","마취통증의학과","회복실","","요통, 오십견에 의한 어깨통증, 수술 후 통증치료, 대상;포진 후 신경통 진료"
2019,"광주","마취통증의학과","통증클리닉","",""
2019,"광주","마취통증의학과","외래환자 마취실","",""
2019,"광주","응급의학과","","초음파진단기(이동)","광주,전남/북권역에서 발생되는 응급환자 발생시 신속 정확한 초기단계의 진료를"
2019,"광주","응급의학과","","Automatic Blood","통해 응급환자의 생명을 보존하고 진료를 위한 타진료영역과 연계를 통하여 효율"
2019,"광주","응급의학과","","Gas Analyzer","적인 진료 응급환자들에게 양질의 진료를 제공하기 위해 24시간 진료체제로 운영"
2019,"광주","혈액종양내과","","Blood Warmer","각종 혈액 질환과 종양의 진단과 치료를 담당"
2019,"광주","혈액종양내과","","","급만성백혈병, 악성림프종, 골수형성이상증후군, 다발성골수증 등과 같은 혈액 질환을 치료"
2019,"광주","혈액종양내과","","","두경부암, 폐암, 식도암, 위암, 간암, 췌담도암 등과 같은 종양을 치료"
2019,"서울","소화기내과","간질환 클리닉","","급·만성 간염, 알콜성 및 비알콜성 지방간 및 지방간염, 간경변 및 합병증 간암 등을 진단·치료"
2019,"서울","소화기내과","위장간 클리닉","","식도질환(식도염, 식도궤양, 식도암)을 진단하여 치료, 위·십이지장 질환(기능성 위장 장애, 위염, 소화성 궤양, 협착, 위암)등의 진단 및 치료, 소장 및 대장 질환(과민성 대장 증후군, 염증성 장질환, 허혈성 장질환, 대장게실, 감염성 대장염, 소장염소장마비, 대장염, 대장마비, 소장 및 대장암)등을 진단하고 치료"
2019,"서울","소화기내과","췌담도 클리닉","","담낭 및 담도결석, 담도암, 급·만성 췌장염, 췌장암 등을 진단·치료"
2019,"서울","소화기내과","췌담도 클리닉","치료 내시경","급성출혈의 내시경적 지혈, 조기 위암, 식도암, 대장암의 내시경적 절제술, 위 및 대장 용종절제술, 위장관 이물제거, 위장관 협착 확장술"
2019,"서울","내분비내과","당뇨 클리닉","","당뇨병의 진단 및 추적 검사, 합병증 검사, 당뇨교육"
2019,"서울","내분비내과","갑상선 클리닉","","갑상선 기능 이상, 갑상선 결절의 진단 및 조직검사"
2019,"서울","내분비내과","골다공증 클리닉","","골다공증의 진단(골밀도 검사)과 진료"
2019,"서울","내분비내과","뇌하수체 및 부신 클리닉","","뇌하수체 및 부신 질환의 진료"
2019,"서울","순환기내과","고혈압 클리닉","24시간활동 혈압측정기 7대","혈압측정, 고지혈증검사, 소변 혈당검사, 심초음파 등을 통한 고혈압 치료부터 교육"
2019,"서울","순환기내과","관상동맥질환 클리닉","운동부하검사기 1대","협심증과 심근경색증환자에 대한 심초음파, 운동부하 심전도 및 심혈관조영술, 성형 등을 통해 진단과 치료를 체계적 시행"
2019,"서울","순환기내과","관상동맥질환 클리닉","SPECT",""
2019,"서울","순환기내과","관상동맥질환 클리닉","Cardiac CT",""
2019,"서울","순환기내과","관상동맥질환 클리닉","심혈관 조영촬영기",""
2019,"서울","순환기내과","심장판막 클리닉","","심장판막의 협착과 폐쇄부전증에 대해 심초음파를 통한 진단과 판막 성형술 등의 시행"
2019,"서울","순환기내과","심혈관 조영실","심혈관조영 촬영기 2대","협심증 또는 급성심근경색증 환자에서심혈관조영술과 풍선확장술 및 그물망 삽입술"
2019,"서울","순환기내과","심혈관 조영실","혈관내 초음파기",""
2019,"서울","순환기내과","심장초음파실","심초음파 진단기 6대","심근경색증, 허혈성심질환, 선천성심질환, 판막질환, 심내막염 등 심장의 구조적, 기능적 이상을 확인"
2019,"서울","순환기내과","부정맥 클리닉","24시간 Holter 12대","부정맥 진단에 유요한 검사로 일상생활중 간헐적으로 발생되는 심계항진이나 호흡곤란, 흉통 등의 증상과 부정맥과의 연관성,"
2019,"서울","순환기내과","부정맥 클리닉","Event Recorder(간헐적 심전도 검사)","연관성, 항부정맥제의 효과 판정, 인공심박동기의 상태 판정 등에 유용한 검사"
2019,"서울","순환기내과","심전도실","심전도기 4대","다양한 심장질환의 진단과 치료에 기본이 되는 검사"
2019,"서울","순환기내과","심전도실","운동부하 심전도기",""
2019,"서울","순환기내과","심혈관센터","","경식도초음파, 경피적 관상동맥 중재술(PCI), 대동맥류 시술, 경피적 대동맥판막치환술(TAVI), 전극도자절제술(RFCA), 영구적심박동기삽입술(PPM) 시행"
2019,"서울","호흡기내과","폐암 클리닉","PFT","염증성 질환  폐렴, 폐결핵, 폐농양, 비결핵항산균 폐질환, 객혈"
2019,"서울","호흡기내과","결핵 클리닉","Bronchoscopy","기도 질환  만성폐쇄성폐질환(폐기종, 만성기관지염), 천식, 기관지확장증"
2019,"서울","호흡기내과","알레르기 클리닉","EBUS","늑막 질환  늑막염, 기흉, 농흉 간질성 폐질환  특발성 폐섬유화증 및 면역질환 관련 간질성 폐질환 종양  폐암, 양성폐종양 중환자실  급성호흡부전, 중환자치료 알레르기  만성기침, 비염, 만성두드러기, 약물알레르기, 호산구증가증, 알레르기 질환 폐기능검사실  다양한 호흡기 질환을 진단하기 위한 폐기능검사 기관지내시경  폐암 및 각종 감염성 폐질환 진단 초음파기관지내시경  폐암의 진단 및 병기결정, 악성질환의 종격동 림프절 전이 진단"
2019,"서울","신장내과","혈액투석실","혈액투석기 25대","유지혈액투석 및 응급투석"
2019,"서울","신장내과","혈액투석실","B.Braun 25대","타과 혈액투석 환자 관리"
2019,"서울","신장내과","혈액투석실","B.Braun 26대","혈관통로 관리"
2019,"서울","신장내과","복막투석실","","유지복막투석 시행 외래환자 및 타과포함 병동 복막투석 환자 관리 복막투석 수술 후 환자관리 복막투석 환자의 정기적 도관 set 교환 투석 전 환자 투석교육 외래 환자들의 조혈제 사용 교육 말기 신부전 환자 영양 교육 신생검(biopsy) 실시 체수분 검사"
2019,"서울","신장내과","사구체신염 클리닉","복부초음파기기","다양한 사구체신염의 진단 및 치료"
2019,"서울","신장내과","사구체신염 클리닉","Sosonite","진단을 위한 신장 조직검사 시행"
2019,"서울","신장내과","신장이식센터","","신이식전과 이식후 환자의 진료 신이식 예정 환자의 관리"
2019,"서울","신장내과","만성콩팥병 클리닉","","만성 신장병 환자들의 단계별 관리 및 약물치료, 영양교육 투석 전 단계 환자의 투석 전 관리"
2019,"서울","신장내과","중환자실 CRRT","CRRT 7대","중환자실 CRRT 운용 및 전공의 교육"
