"진료과","부속부서","보유장비","진료 내용"
"재활센터","인지치료실 ","전산화인지치료프로그램","현실성 있는 훈련 프로그램으로 컴퓨터 화면등에서 주어지는 과제를 해결함으로써 기능향상과 일상생활에서의 문제 해결 능력 향상"
"재활센터","언어치료실","닥터스피치","언어장애가 있는 환자를 평가하고 적절한 접근으로 언어장애 치료"
"재활센터","상지로봇치료실","상지로봇치료기","프로그램을 이용하여 뇌가소성을 증진시켜 독립적인 일상생활과 상지의 기능회복을 촉구함"
"재활센터","보행로봇치료실","보행로봇치료실","견인장치로 하지고정후 프로그램을 통하여 정상적인 보행양식을 환자에게 유도하는 맞춤형 보행훈련"
"재활센터","척수손상재활","","척수손상으로 인한 상하지 기능장애 환자들의 장애평가 및 적절한 치료방향 설정 및 교육, 척수손상환자의 생애주기별 맞춤 건강검진 및 치료"
"재활센터","뇌졸중재활","","뇌졸중 이후에 발생하는 신체적, 정식적, 사회적 장애를 최소화 하기위해 평가 및 적절한 치료방향 설정 및 치료"
"재활센터","뇌손상 및 퇴행성","","외상성 뇌손상 또는 파킨슨 병과 같은 퇴행성 중추신경계질환으로 장애를 평가하고 치료를 통하여 장애를 최소화 하고 사회통합을 유도함 "
"재활센터","중추신경질환재활","",""
"재활센터","절단장애 재활","","절단장애 후 절단부위 관리, 적합한 의지보조기 처방 및 적용훈련 "
"재활센터","노인재활","","초고령 사회를 대비하여 각종 노인성 질환에 대한 연구 및 치료 "
"재활센터","근골격계 재활치료","","각종 근골격계 통증 및 퇴행성 관절염, 척추수술 후 및 관절치환술 후 재활프로그램 운동치료, 통증재활수기, 각종 통증교실을 통한 지속적인 환자교육"
"재활센터","수중재활치료","","물의 물리적인 특성을 이용하여 비정상적인 움직임의 패턴들을 다양한 수중 기법을 통하여 정상적인 움직임으로 회복 또는 증진"
"재활센터","인지재활클리닉 ","전산화인지치료프로그램 ","뇌졸중 및 뇌손상후 발생한 인지장애에 대해 약물치료 및 전산화 인지기능 평가 및 치료"
"재활센터","연하장애 클리닉","비디오투시검사","뇌병변 및 중추신경 손상, 두경부 수술 후 발생한 연하장애 환자들의 연하기능평가 및 치료"
"재활센터","경직 클리닉","근전도 검사기","편마비, 척수손상 등으로 인한 경직 완화 중재시술을 근전도 또는 초음파기기 모니터링 하에 실시"
"재활센터","경직 클리닉","초음파진단기",""
"재활센터","의지보조기 클리닉 ","","보장구센터와 협진을 통하여 절단 및 기능장애 환자들에게 적절한 보장구 처방 교육"
"재활센터","장애인스포츠 재활클리닉","","스트레칭 및 재활운동을 통하여 기능유지 및 기능회복 훈련 및 환자의 잔존능력에 따른 적합한 스포츠 활동 처방 "
"재활센터","뇌자극치료 클리닉","경두개 자기자극치료기","자기장을 이용하여 뇌의 특정부위를 국소적으로 자극하여 손상된 뇌기능을 회복시키는 치료법 "
"재활센터","호흡재활클리닉","","만성폐쇄성폐질환, 신경근육성 질환으로 인한 호흡부전을 평가하고 기계호흡접근, 호흡근 강화운동 등 환자의 호흡기능을 유지시키기 위한 재활 치료 시행"
"재활센터","재활체육치료 프로그램","스트레칭장","신체적능력이 저하되어 운동능력이 부족한 환자들을 대상으로 체육교사의 지도에 따라 체육활동을 하고 있음"
"재활센터","재활체육치료 프로그램","체력단련기구",""
"재활센터","일상생활체험 프로그램","일상생활체험실","장애인전용 가구등이 설치되어 있는 독립생활관으로 퇴소 후 환자의 주거상황 및 장애정도에 맞게 일상생활을 영위할수 있도록 하여 사회복귀를 촉진시키는 프로그램"
"재활센터","방문물리/작업치료","","통원치료가 어려운 환자에게 집으로 찾아가 물리치료 및 작업 재활치료를 제공하고 있음"
"재활센터","프로그램","",""
"치과병원","보철과","","총의치, 국소의치, 고정성 보철, 임플란트 보철, 악안면보철, 심미보철, 교합치료, 디지털 보철치료"
"치과병원","구강악안면외과","","구강악안면감염, 턱관절외과, 양성종양치료, 골절 수술, 치조골 이식술, 매복 사랑니 발치, 악골내낭종적출, 악골골절수술"
"치과병원","치주과","","치주질환, 잇몸질환, 심미치주치료, 임플란트"
"치과병원","보존과","미세현미경","근관치료, 충치치료, 심미수복, 미세치근단 현미경 수술, 치아외상, 치아미백, 임플란트"
"치과병원","구강내과","하악운동분석기(K7)","턱관절 질환, 구강악안면통증, 구강연조직질환, 코골이장치, 구취진단 및 검사, "
"치과병원","구강내과","구취측정기(Oral Chroma)","구강건조증"
"치과병원","구강내과","안면신경검사기(Neurometer CPT)",""
"치과병원","구강내과","물리치료기기",""
"치과병원","통합치의학과","","임플란트, 크라운/브릿지, 틀니, 근관 및 수복치료 등 종합적인 치과진료"
"치과병원","방사선실","CBCT","원추 형태의 방사선을 이용하여 촬영하며 낮은 선량으로 악안면 부위의 정밀한 영상을 얻어 진단을 하는 장비"
"치과병원","방사선실","Panorama","치과 영상의 대표적 구외촬영장비로 상하 악골 및 안면구조물을 하나의 연속된 영상으로 보여주는 검사장비"
"치과병원","기공실","기공용 엔진","치아 보철물 절단, 연마, 광택 장비"
"치과병원","기공실","고주파주조기","골드, 금속을 녹여 주조체 만드는 장비"
"치과병원","기공실","CAD/CAM","정밀 보철물 제작 장비"
"치과병원","기공실","Laser Welder","의치수리 및 부적합한 보철물 수정 장비"
